#columns:point_slug	jlpt	module	bunpro_id	tofugu_url	imabi_url	shinkanzen_ref	djg_page	notes
は-となっている	n3	03-n3	bunpro:は-となっている			sk:auto/n3	djg:bunpro/は-となっている	strict-deck; bunpro:は-となっている; ～は～となっている; It is (has been), Have/has become, Happen to be, Has been established
はもちろん	n3	03-n3	bunpro:はもちろん			sk:auto/n3	djg:bunpro/はもちろん	strict-deck; bunpro:はもちろん; はもちろん; Not only but also, Let alone, Not to mention, Of course
は言うまでもない1	n3	03-n3	bunpro:は言うまでもない1			sk:auto/n3	djg:bunpro/は言うまでもない1	strict-deck; bunpro:は言うまでもない1; は言うまでもない ①; It goes without saying (that), (It is) needless to say, I don't need to remind you
ば-ほど	n3	03-n3	bunpro:ば-ほど			sk:auto/n3	djg:bunpro/ば-ほど	strict-deck; bunpro:ば-ほど; ば〜ほど; The more…the more
ばいい	n3	03-n3	bunpro:ばいい			sk:auto/n3	djg:bunpro/ばいい	strict-deck; bunpro:ばいい; ばいい; Can, Should, It'd be good if
ばかり	n3	03-n3	bunpro:ばかり			sk:auto/n3	djg:bunpro/ばかり	strict-deck; bunpro:ばかり; ばかり; Just, Only, Nothing but
ばかりだ	n3	03-n3	bunpro:ばかりだ			sk:auto/n3	djg:bunpro/ばかりだ	strict-deck; bunpro:ばかりだ; ばかりだ; (Only) continue to, Keep on -ing, More and more
ばかりでなく	n3	03-n3	bunpro:ばかりでなく			sk:auto/n3	djg:bunpro/ばかりでなく	strict-deck; bunpro:ばかりでなく; ばかりでなく; Not only…but also, As well as
ばかりに	n3	03-n3	bunpro:ばかりに			sk:auto/n3	djg:bunpro/ばかりに	strict-deck; bunpro:ばかりに; ばかりに; Simply because, Only because, Just because, Simply on account of
ふりをする	n3	03-n3	bunpro:ふりをする			sk:auto/n3	djg:bunpro/ふりをする	strict-deck; bunpro:ふりをする; ふりをする; To pretend, To act as if
べき	n3	03-n3	bunpro:べき			sk:auto/n3	djg:bunpro/べき	strict-deck; bunpro:べき; べき; Must, Should , Ought to
べきではない	n3	03-n3	bunpro:べきではない			sk:auto/n3	djg:bunpro/べきではない	strict-deck; bunpro:べきではない; べきではない; Should not, Must not , Ought not to
ほど	n3	03-n3	bunpro:ほど			sk:auto/n3	djg:bunpro/ほど	strict-deck; bunpro:ほど; ほど; The more, About, To the extent that, So much… that
ほど～ない	n3	03-n3	bunpro:ほど～ない			sk:auto/n3	djg:bunpro/ほど～ない	strict-deck; bunpro:ほど～ない; ほど～ない; Is not as…as, Isn't... like..., Not to the extent of...
まさか	n3	03-n3	bunpro:まさか			sk:auto/n3	djg:bunpro/まさか	strict-deck; bunpro:まさか; まさか; I never dreamed, Never, No way, Don't tell me, You don't say
ますます	n3	03-n3	bunpro:ますます			sk:auto/n3	djg:bunpro/ますます	strict-deck; bunpro:ますます; ますます; Increasingly, More and more, Decreasingly, Less and less, Keep -ing
まま	n3	03-n3	bunpro:まま			sk:auto/n3	djg:bunpro/まま	strict-deck; bunpro:まま; まま(に); As is, While remaining, Left in a state
まるで-ようだ	n3	03-n3	bunpro:まるで-ようだ			sk:auto/n3	djg:bunpro/まるで-ようだ	strict-deck; bunpro:まるで-ようだ; まるで…ようだ; It is entirely as if, It is just as though
み	n3	03-n3	bunpro:み			sk:auto/n3	djg:bunpro/み	strict-deck; bunpro:み; み; ~ness, Used to indicate conditions or nature
むしろ	n3	03-n3	bunpro:むしろ			sk:auto/n3	djg:bunpro/むしろ	strict-deck; bunpro:むしろ; むしろ; Rather, Instead, Over
めったに-ない	n3	03-n3	bunpro:めったに-ない			sk:auto/n3	djg:bunpro/めったに-ない	strict-deck; bunpro:めったに-ない; めったに〜ない; Hardly, Rarely, Seldom
もしかしたら	n3	03-n3	bunpro:もしかしたら			sk:auto/n3	djg:bunpro/もしかしたら	strict-deck; bunpro:もしかしたら; もしかしたら; Perhaps, Maybe, Possibly
もしも～なら・もしも～でも	n3	03-n3	bunpro:もしも～なら・もしも～でも			sk:auto/n3	djg:bunpro/もしも～なら・もしも～でも	strict-deck; bunpro:もしも～なら・もしも～でも; もしも～なら・もしも～でも;  If, Supposing
もっとも	n3	03-n3	bunpro:もっとも			sk:auto/n3	djg:bunpro/もっとも	strict-deck; bunpro:もっとも; もっとも; Although, But, However, For all that, Provided that
もの-もん	n3	03-n3	bunpro:もの-もん			sk:auto/n3	djg:bunpro/もの-もん	strict-deck; bunpro:もの-もん; もの・もん; Because, Cause
ものだ	n3	03-n3	bunpro:ものだ			sk:auto/n3	djg:bunpro/ものだ	strict-deck; bunpro:ものだ; ものだ; Supposed to, Should, That's the way it is
ような気がする	n3	03-n3	bunpro:ような気がする			sk:auto/n3	djg:bunpro/ような気がする	strict-deck; bunpro:ような気がする; ような気がする; Have a feeling that
わけがない	n3	03-n3	bunpro:わけがない			sk:auto/n3	djg:bunpro/わけがない	strict-deck; bunpro:わけがない; わけがない; There is no way, There is no reason, It is impossible, Cannot be
わけだ	n3	03-n3	bunpro:わけだ			sk:auto/n3	djg:bunpro/わけだ	strict-deck; bunpro:わけだ; わけだ; For that reason, No wonder, As you'd expect, Naturally, Thus, This is why
わけではない	n3	03-n3	bunpro:わけではない			sk:auto/n3	djg:bunpro/わけではない	strict-deck; bunpro:わけではない; わけではない; It doesn't mean that, It is not the case, It's not like
わけにはいかない	n3	03-n3	bunpro:わけにはいかない			sk:auto/n3	djg:bunpro/わけにはいかない	strict-deck; bunpro:わけにはいかない; わけにはいかない; Cannot afford to, No way, Impossible to do
わざわざ	n3	03-n3	bunpro:わざわざ			sk:auto/n3	djg:bunpro/わざわざ	strict-deck; bunpro:わざわざ; わざわざ; Expressly, Especially, Go out of one's way, Take the trouble to
わりに	n3	03-n3	bunpro:わりに			sk:auto/n3	djg:bunpro/わりに	strict-deck; bunpro:わりに; 割に; Although, Despite, Rather...for, Unexpectedly, Comparatively, Considering
をはじめ	n3	03-n3	bunpro:をはじめ			sk:auto/n3	djg:bunpro/をはじめ	strict-deck; bunpro:をはじめ; をはじめ; Not only...but also..., Starting with
んじゃない	n3	03-n3	bunpro:んじゃない			sk:auto/n3	djg:bunpro/んじゃない	strict-deck; bunpro:んじゃない; んじゃない; Don't, Mustn't, Shouldn't have
んだって	n3	03-n3	bunpro:んだって			sk:auto/n3	djg:bunpro/んだって	strict-deck; bunpro:んだって; んだって; I heard that, He or She said that
一体	n3	03-n3	bunpro:一体			sk:auto/n3	djg:bunpro/一体	strict-deck; bunpro:一体; 一体; (What) the heck?, (Who) in the world?, (Where) on earth?, (How many) f*ing...
一方だ	n3	03-n3	bunpro:一方だ			sk:auto/n3	djg:bunpro/一方だ	strict-deck; bunpro:一方だ; 一方だ; More and more, Continue to, Keep on, -er and -er
一方で	n3	03-n3	bunpro:一方で			sk:auto/n3	djg:bunpro/一方で	strict-deck; bunpro:一方で; 一方で; On the other hand, At the same time, While
上がる-上げる	n3	03-n3	bunpro:上がる-上げる			sk:auto/n3	djg:bunpro/上がる-上げる	strict-deck; bunpro:上がる-上げる; 上がる・上げる; Something is finished, To finish something, Something has come to an end, To do something completely, To do something through
上で	n3	03-n3	bunpro:上で			sk:auto/n3	djg:bunpro/上で	strict-deck; bunpro:上で; 上で; After, Upon
中	n3	03-n3	bunpro:中			sk:auto/n3	djg:bunpro/中	strict-deck; bunpro:中; 中; During, While, Throughout, In the process of
代わりに	n3	03-n3	bunpro:代わりに			sk:auto/n3	djg:bunpro/代わりに	strict-deck; bunpro:代わりに; 代わりに; Instead of,  In place of, In exchange for
全く-ない	n3	03-n3	bunpro:全く-ない			sk:auto/n3	djg:bunpro/全く-ない	strict-deck; bunpro:全く-ない; 全く～ない; Not~at all
再び	n3	03-n3	bunpro:再び			sk:auto/n3	djg:bunpro/再び	strict-deck; bunpro:再び; 再び; Again, Once more, A second time
切る	n3	03-n3	bunpro:切る			sk:auto/n3	djg:bunpro/切る	strict-deck; bunpro:切る; 切る; To do something completely to the end, Utterly, Resolutely
切れない	n3	03-n3	bunpro:切れない			sk:auto/n3	djg:bunpro/切れない	strict-deck; bunpro:切れない; 切れない; Being unable to finish or complete
別に-ない	n3	03-n3	bunpro:別に-ない			sk:auto/n3	djg:bunpro/別に-ない	strict-deck; bunpro:別に-ない; 別に〜ない; Not really, Not particularly, It's not like...
前者は-後者は	n3	03-n3	bunpro:前者は-後者は			sk:auto/n3	djg:bunpro/前者は-後者は	strict-deck; bunpro:前者は-後者は; 前者は・後者は; The former ~ the latter, The first ~ the second
即ち	n3	03-n3	bunpro:即ち			sk:auto/n3	djg:bunpro/即ち	strict-deck; bunpro:即ち; 即ち; In other words, That is, Namely
却って	n3	03-n3	bunpro:却って			sk:auto/n3	djg:bunpro/却って	strict-deck; bunpro:却って; 却って; All the more, On the contrary, Conversely
又-も	n3	03-n3	bunpro:又-も			sk:auto/n3	djg:bunpro/又-も	strict-deck; bunpro:又-も; 又〜も; Moreover, Additionally, And also, In addition, Furthermore, Or
合う	n3	03-n3	bunpro:合う			sk:auto/n3	djg:bunpro/合う	strict-deck; bunpro:合う; 合う; To do for one another, Mutually, With
同士	n3	03-n3	bunpro:同士			sk:auto/n3	djg:bunpro/同士	strict-deck; bunpro:同士; 同士; Fellow, With each other, Mutually, Between, Among, Together, With
向き	n3	03-n3	bunpro:向き			sk:auto/n3	djg:bunpro/向き	strict-deck; bunpro:向き; 向き; Suitable for, Facing
向け	n3	03-n3	bunpro:向け			sk:auto/n3	djg:bunpro/向け	strict-deck; bunpro:向け; 向け; Intended for, Aimed at
左右する	n3	03-n3	bunpro:左右する			sk:auto/n3	djg:bunpro/左右する	strict-deck; bunpro:左右する; 左右する; Influence, Impact, Control
当たり	n3	03-n3	bunpro:当たり			sk:auto/n3	djg:bunpro/当たり	strict-deck; bunpro:当たり; 当たり; Per~, A~, Apiece, Each
必ずしも	n3	03-n3	bunpro:必ずしも			sk:auto/n3	djg:bunpro/必ずしも	strict-deck; bunpro:必ずしも; 必ずしも ; Not always, Not entirely, Not necessarily
最中に	n3	03-n3	bunpro:最中に			sk:auto/n3	djg:bunpro/最中に	strict-deck; bunpro:最中に; 最中に; In the middle of
次第	n3	03-n3	bunpro:次第			sk:auto/n3	djg:bunpro/次第	strict-deck; bunpro:次第; 次第; As soon as
決して-ない	n3	03-n3	bunpro:決して-ない			sk:auto/n3	djg:bunpro/決して-ない	strict-deck; bunpro:決して-ない; 決して〜ない; Never, By no means
点	n3	03-n3	bunpro:点			sk:auto/n3	djg:bunpro/点	strict-deck; bunpro:点; 点; Aspect, Respect, Point, Way, In terms of, In that, From the point of view
的	n3	03-n3	bunpro:的			sk:auto/n3	djg:bunpro/的	strict-deck; bunpro:的; 的; ~ly・~like・~al, Typical
直ちに	n3	03-n3	bunpro:直ちに			sk:auto/n3	djg:bunpro/直ちに	strict-deck; bunpro:直ちに; 直ちに; At once, Immediately, As soon as
第一	n3	03-n3	bunpro:第一			sk:auto/n3	djg:bunpro/第一	strict-deck; bunpro:第一; 第一; Start, First (point), Foremost, To begin with
考えられない	n3	03-n3	bunpro:考えられない			sk:auto/n3	djg:bunpro/考えられない	strict-deck; bunpro:考えられない; 考えられない; Unthinkable, Inconceivable, Unimaginable, Cannot think
言うまでもない2	n3	03-n3	bunpro:言うまでもない2			sk:auto/n3	djg:bunpro/言うまでもない2	strict-deck; bunpro:言うまでもない2; 言うまでもない ②; It goes without saying, It is needless to say, Of course, Obviously
込む1	n3	03-n3	bunpro:込む1			sk:auto/n3	djg:bunpro/込む1	strict-deck; bunpro:込む1; 込む ①; To go into, To put into
込む2	n3	03-n3	bunpro:込む2			sk:auto/n3	djg:bunpro/込む2	strict-deck; bunpro:込む2; 込む ②; Remain, To do thoroughly, Deeply, Intensely
連用形	n3	03-n3	bunpro:連用形			sk:auto/n3	djg:bunpro/連用形	strict-deck; bunpro:連用形; 連用形; Formal Conjunctive
遂に	n3	03-n3	bunpro:遂に			sk:auto/n3	djg:bunpro/遂に	strict-deck; bunpro:遂に; 遂に; Finally, At last
関係がある	n3	03-n3	bunpro:関係がある			sk:auto/n3	djg:bunpro/関係がある	strict-deck; bunpro:関係がある; 関係がある; (Not) involved with, (Not) concerned with, (No) connection with, (No) relationship with, (Not) related to
-てこそ	n2	04-n2	bunpro:-てこそ			sk:auto/n2	djg:bunpro/-てこそ	strict-deck; bunpro:-てこそ; ～てこそ; Only if, Because, By, Unless, Until
-のうち-で	n2	04-n2	bunpro:-のうち-で			sk:auto/n2	djg:bunpro/-のうち-で	strict-deck; bunpro:-のうち-で; ～のうち(で); Of the, Among(st)
あげく	n2	04-n2	bunpro:あげく			sk:auto/n2	djg:bunpro/あげく	strict-deck; bunpro:あげく; あげく; After, In the end, After all, Eventually
いきなり	n2	04-n2	bunpro:いきなり			sk:auto/n2	djg:bunpro/いきなり	strict-deck; bunpro:いきなり; いきなり; For no reason, Suddenly, All of a sudden
いつの間にか	n2	04-n2	bunpro:いつの間にか			sk:auto/n2	djg:bunpro/いつの間にか	strict-deck; bunpro:いつの間にか; いつの間にか; Suddenly, Unnoticed, Without noticing, Too soon
いよいよ	n2	04-n2	bunpro:いよいよ			sk:auto/n2	djg:bunpro/いよいよ	strict-deck; bunpro:いよいよ; いよいよ; At last, Finally, More and more
いわゆる	n2	04-n2	bunpro:いわゆる			sk:auto/n2	djg:bunpro/いわゆる	strict-deck; bunpro:いわゆる; いわゆる; What is called, So-called, Generally known
お-願う	n2	04-n2	bunpro:お-願う			sk:auto/n2	djg:bunpro/お-願う	strict-deck; bunpro:お-願う; お～願う; Please, Could you please
おおよそ	n2	04-n2	bunpro:おおよそ			sk:auto/n2	djg:bunpro/おおよそ	strict-deck; bunpro:おおよそ; おおよそ; Approximately, Roughly, About, Outline, Gist
おそらく	n2	04-n2	bunpro:おそらく			sk:auto/n2	djg:bunpro/おそらく	strict-deck; bunpro:おそらく; おそらく; Probably, Perhaps, (Most) likely, (I) fear that
おまけに	n2	04-n2	bunpro:おまけに			sk:auto/n2	djg:bunpro/おまけに	strict-deck; bunpro:おまけに; おまけに; In addition, On top of that, What is more, To make matters worse
および	n2	04-n2	bunpro:および			sk:auto/n2	djg:bunpro/および	strict-deck; bunpro:および; および; And, As well as
か-ないかのうちに	n2	04-n2	bunpro:か-ないかのうちに			sk:auto/n2	djg:bunpro/か-ないかのうちに	strict-deck; bunpro:か-ないかのうちに; か〜ないかのうちに; Right after, As soon as, Just when, Barely
かと思ったら-かと思うと	n2	04-n2	bunpro:かと思ったら-かと思うと			sk:auto/n2	djg:bunpro/かと思ったら-かと思うと	strict-deck; bunpro:かと思ったら-かと思うと; かと思ったら・かと思うと; Then again, Just when I thought, No sooner than
かねない	n2	04-n2	bunpro:かねない			sk:auto/n2	djg:bunpro/かねない	strict-deck; bunpro:かねない; かねない; Might, Could be, Capable of, Possible
かねる	n2	04-n2	bunpro:かねる			sk:auto/n2	djg:bunpro/かねる	strict-deck; bunpro:かねる; かねる; Cannot, Be unable to, Hard to, Hesitant to
かのようだ	n2	04-n2	bunpro:かのようだ			sk:auto/n2	djg:bunpro/かのようだ	strict-deck; bunpro:かのようだ; かのようだ; As if, Just like
からして	n2	04-n2	bunpro:からして			sk:auto/n2	djg:bunpro/からして	strict-deck; bunpro:からして; からして; Even..., Judging from, Based on
からすると-からすれば	n2	04-n2	bunpro:からすると-からすれば			sk:auto/n2	djg:bunpro/からすると-からすれば	strict-deck; bunpro:からすると-からすれば; からすると・からすれば; Judging from, Considering
からといって	n2	04-n2	bunpro:からといって			sk:auto/n2	djg:bunpro/からといって	strict-deck; bunpro:からといって; からといって; Just because
からには	n2	04-n2	bunpro:からには			sk:auto/n2	djg:bunpro/からには	strict-deck; bunpro:からには; からには; As long as, Since, Given
から見ると	n2	04-n2	bunpro:から見ると			sk:auto/n2	djg:bunpro/から見ると	strict-deck; bunpro:から見ると; から見ると; From the point of view of, By the look of
か何か	n2	04-n2	bunpro:か何か			sk:auto/n2	djg:bunpro/か何か	strict-deck; bunpro:か何か; か何か; Or something, Or something like that
がけに	n2	04-n2	bunpro:がけに			sk:auto/n2	djg:bunpro/がけに	strict-deck; bunpro:がけに; がけに; On the way to, As you go
が気になる	n2	04-n2	bunpro:が気になる			sk:auto/n2	djg:bunpro/が気になる	strict-deck; bunpro:が気になる; が気になる; To be interested in, To be concerned about
きっかけ	n2	04-n2	bunpro:きっかけ			sk:auto/n2	djg:bunpro/きっかけ	strict-deck; bunpro:きっかけ; きっかけ; Lead to, Because of, As a start or trigger of, An opportunity
げ	n2	04-n2	bunpro:げ			sk:auto/n2	djg:bunpro/げ	strict-deck; bunpro:げ; げ; Seemingly, Giving appearance of, [Expresses emotions or feelings]
ことだから	n2	04-n2	bunpro:ことだから			sk:auto/n2	djg:bunpro/ことだから	strict-deck; bunpro:ことだから; ことだから; It is exactly because
ことなく	n2	04-n2	bunpro:ことなく			sk:auto/n2	djg:bunpro/ことなく	strict-deck; bunpro:ことなく; ことなく; Without ~ing
ことになっている	n2	04-n2	bunpro:ことになっている			sk:auto/n2	djg:bunpro/ことになっている	strict-deck; bunpro:ことになっている; ことになっている; To be expected to, To be scheduled to
ことにはならない	n2	04-n2	bunpro:ことにはならない			sk:auto/n2	djg:bunpro/ことにはならない	strict-deck; bunpro:ことにはならない; ことにはならない; Just because… doesn't mean…
ことは-が	n2	04-n2	bunpro:ことは-が			sk:auto/n2	djg:bunpro/ことは-が	strict-deck; bunpro:ことは-が; ことは〜が; It is true...but, although, but
さすが	n2	04-n2	bunpro:さすが			sk:auto/n2	djg:bunpro/さすが	strict-deck; bunpro:さすが; さすが; as one would expect, only natural, that is just like..., even
さらに	n2	04-n2	bunpro:さらに			sk:auto/n2	djg:bunpro/さらに	strict-deck; bunpro:さらに; 更に; Even more or further, Again, More and more
ざる	n2	04-n2	bunpro:ざる			sk:auto/n2	djg:bunpro/ざる	strict-deck; bunpro:ざる; ～ざる; To not ~, Un~
ざるを得ない	n2	04-n2	bunpro:ざるを得ない			sk:auto/n2	djg:bunpro/ざるを得ない	strict-deck; bunpro:ざるを得ない; ざるを得ない; Can't help doing, Have no choice but
しかしながら	n2	04-n2	bunpro:しかしながら			sk:auto/n2	djg:bunpro/しかしながら	strict-deck; bunpro:しかしながら; しかしながら; However, Nevertheless, But
しかも	n2	04-n2	bunpro:しかも			sk:auto/n2	djg:bunpro/しかも	strict-deck; bunpro:しかも; しかも; Moreover, Furthermore
したがって	n2	04-n2	bunpro:したがって			sk:auto/n2	djg:bunpro/したがって	strict-deck; bunpro:したがって; したがって; Therefore, Thus, As a result
ずに済む	n2	04-n2	bunpro:ずに済む			sk:auto/n2	djg:bunpro/ずに済む	strict-deck; bunpro:ずに済む; ずに済む; Get by without doing something, To get away with
せめて	n2	04-n2	bunpro:せめて			sk:auto/n2	djg:bunpro/せめて	strict-deck; bunpro:せめて; せめて; At least
そういえば	n2	04-n2	bunpro:そういえば			sk:auto/n2	djg:bunpro/そういえば	strict-deck; bunpro:そういえば; そういえば; Speaking of which, By the way, Come to think of it
そうにない	n2	04-n2	bunpro:そうにない			sk:auto/n2	djg:bunpro/そうにない	strict-deck; bunpro:そうにない; そうにない; Unlikely to, Showing no signs of
その上	n2	04-n2	bunpro:その上			sk:auto/n2	djg:bunpro/その上	strict-deck; bunpro:その上; その上; Besides, In addition, Furthermore
それとも	n2	04-n2	bunpro:それとも			sk:auto/n2	djg:bunpro/それとも	strict-deck; bunpro:それとも; それとも; Or, Or else, Rather
それなのに	n2	04-n2	bunpro:それなのに			sk:auto/n2	djg:bunpro/それなのに	strict-deck; bunpro:それなのに; それなのに; And yet, Despite this
それなら	n2	04-n2	bunpro:それなら			sk:auto/n2	djg:bunpro/それなら	strict-deck; bunpro:それなら; それなら; Then, If that's the case
それにしても	n2	04-n2	bunpro:それにしても			sk:auto/n2	djg:bunpro/それにしても	strict-deck; bunpro:それにしても; それにしても; Nevertheless, Even so
たちまち	n2	04-n2	bunpro:たちまち			sk:auto/n2	djg:bunpro/たちまち	strict-deck; bunpro:たちまち; たちまち; Immediately, Quickly, Suddenly, In a moment or flash
たった-の	n2	04-n2	bunpro:たった-の			sk:auto/n2	djg:bunpro/たった-の	strict-deck; bunpro:たった-の; たった(の); Only, Just, No more than
たって	n2	04-n2	bunpro:たって			sk:auto/n2	djg:bunpro/たって	strict-deck; bunpro:たって; たって; Even if, Even though, No matter how
たまえ	n2	04-n2	bunpro:たまえ			sk:auto/n2	djg:bunpro/たまえ	strict-deck; bunpro:たまえ; たまえ; (Please) do!, Ask to, Beg to, (Order somebody to do something)
た末-の末	n2	04-n2	bunpro:た末-の末			sk:auto/n2	djg:bunpro/た末-の末	strict-deck; bunpro:た末-の末; た末・の末; After, As a conclusion of
だけあって	n2	04-n2	bunpro:だけあって			sk:auto/n2	djg:bunpro/だけあって	strict-deck; bunpro:だけあって; だけあって; Is only natural, …Being the case, Because, As might be expected
だけに	n2	04-n2	bunpro:だけに			sk:auto/n2	djg:bunpro/だけに	strict-deck; bunpro:だけに; だけに; As might be expected, Because, All the more because, It's only natural
だけのことはある	n2	04-n2	bunpro:だけのことはある			sk:auto/n2	djg:bunpro/だけのことはある	strict-deck; bunpro:だけのことはある; だけのことはある; No wonder, Not surprising that, As expected
だけは	n2	04-n2	bunpro:だけは			sk:auto/n2	djg:bunpro/だけは	strict-deck; bunpro:だけは; だけは; To do all that one can, As much or many ~ as one could
だけましだ	n2	04-n2	bunpro:だけましだ			sk:auto/n2	djg:bunpro/だけましだ	strict-deck; bunpro:だけましだ; だけましだ; At least, It's better than..., One should feel grateful for
っこない	n2	04-n2	bunpro:っこない			sk:auto/n2	djg:bunpro/っこない	strict-deck; bunpro:っこない; っこない; There is no chance of, There is no way of, Impossible
つつ	n2	04-n2	bunpro:つつ			sk:auto/n2	djg:bunpro/つつ	strict-deck; bunpro:つつ; つつ; While, And
つつ-も	n2	04-n2	bunpro:つつ-も			sk:auto/n2	djg:bunpro/つつ-も	strict-deck; bunpro:つつ-も; つつ(も); Even while ~ing, Even though ~ing, Despite ~ing, Although ~ing
つつある	n2	04-n2	bunpro:つつある			sk:auto/n2	djg:bunpro/つつある	strict-deck; bunpro:つつある; つつある; -ing, Be -ing
つもりで	n2	04-n2	bunpro:つもりで			sk:auto/n2	djg:bunpro/つもりで	strict-deck; bunpro:つもりで; つもりで; With the intention of doing, Instead of..., Act as if or pretend, Believing that..., Thinking that...
ていては	n2	04-n2	bunpro:ていては			sk:auto/n2	djg:bunpro/ていては	strict-deck; bunpro:ていては; ていては; If one keeps doing something, When, If something is...
てからでないと	n2	04-n2	bunpro:てからでないと			sk:auto/n2	djg:bunpro/てからでないと	strict-deck; bunpro:てからでないと; てからでないと; (Not) unless ~ cannot, (Not) until ~ cannot
てしょうがない	n2	04-n2	bunpro:てしょうがない			sk:auto/n2	djg:bunpro/てしょうがない	strict-deck; bunpro:てしょうがない; てしょうがない; Extremely, Very, Really, It can't be helped
てたまらない	n2	04-n2	bunpro:てたまらない			sk:auto/n2	djg:bunpro/てたまらない	strict-deck; bunpro:てたまらない; てたまらない; Can't help but want to, Very, Extremely
てでも	n2	04-n2	bunpro:てでも			sk:auto/n2	djg:bunpro/てでも	strict-deck; bunpro:てでも; てでも; Even if I have to, By any or all means, No matter what
てならない	n2	04-n2	bunpro:てならない			sk:auto/n2	djg:bunpro/てならない	strict-deck; bunpro:てならない; てならない; Very, Extremely, Can't help but do
ては	n2	04-n2	bunpro:ては			sk:auto/n2	djg:bunpro/ては	strict-deck; bunpro:ては; ては; If, With, Since, Because
ては-ては	n2	04-n2	bunpro:ては-ては			sk:auto/n2	djg:bunpro/ては-ては	strict-deck; bunpro:ては-ては; ては〜ては; Repeating action, If, Since
てはいられない	n2	04-n2	bunpro:てはいられない			sk:auto/n2	djg:bunpro/てはいられない	strict-deck; bunpro:てはいられない; てはいられない; Can't afford to, Unable to
てはならない	n2	04-n2	bunpro:てはならない			sk:auto/n2	djg:bunpro/てはならない	strict-deck; bunpro:てはならない; てはならない; Must not, Cannot, Should not
て当然だ	n2	04-n2	bunpro:て当然だ			sk:auto/n2	djg:bunpro/て当然だ	strict-deck; bunpro:て当然だ; て当然だ; Natural, As a matter of course
て頂戴	n2	04-n2	bunpro:て頂戴			sk:auto/n2	djg:bunpro/て頂戴	strict-deck; bunpro:て頂戴; ～て頂戴; Please do
でしかない	n2	04-n2	bunpro:でしかない			sk:auto/n2	djg:bunpro/でしかない	strict-deck; bunpro:でしかない; でしかない; Merely, Nothing but, No more than
ということは	n2	04-n2	bunpro:ということは			sk:auto/n2	djg:bunpro/ということは	strict-deck; bunpro:ということは; ということは; That means, That is to say
というものだ	n2	04-n2	bunpro:というものだ			sk:auto/n2	djg:bunpro/というものだ	strict-deck; bunpro:というものだ; というものだ; Speaker's impression, Criticism or conclusion
