#columns:point_slug	jlpt	module	bunpro_id	tofugu_url	imabi_url	shinkanzen_ref	djg_page	notes

-んです-のです	n5	01-n5	bunpro:-んです-のです			sk:auto/n5	djg:bunpro/-んです-のです	strict-deck; bunpro:-んです-のです; ～んです・のです; Explanatory, Emphasis, The fact is
adjective-て-b	n5	01-n5	bunpro:adjective-て-b			sk:auto/n5	djg:bunpro/adjective-て-b	strict-deck; bunpro:adjective-て-b; Adjective + て + B; And..., Both and (Conjunctive)
adjective-て-noun-で	n5	01-n5	bunpro:adjective-て-noun-で			sk:auto/n5	djg:bunpro/adjective-て-noun-で	strict-deck; bunpro:adjective-て-noun-で; Adjective + て・Noun + で; And... (Conjunctive)
adjective-の-は	n5	01-n5	bunpro:adjective-の-は			sk:auto/n5	djg:bunpro/adjective-の-は	strict-deck; bunpro:adjective-の-は; Adjective + の(は); The 'one' that... (Indefinite pronoun, Adjective nominalization)
negative-い-adjectives	n5	01-n5	bunpro:negative-い-adjectives			sk:auto/n5	djg:bunpro/negative-い-adjectives	strict-deck; bunpro:negative-い-adjectives; い-Adjectives くない; Not (Adjective)
noun-まで	n5	01-n5	bunpro:noun-まで			sk:auto/n5	djg:bunpro/noun-まで	strict-deck; bunpro:noun-まで; Noun + まで; Until, Till,  To (but no further than)
past-tense-い-adjectives	n5	01-n5	bunpro:past-tense-い-adjectives			sk:auto/n5	djg:bunpro/past-tense-い-adjectives	strict-deck; bunpro:past-tense-い-adjectives; い-Adjective (Past); Was, Were (Past tense)
polite-verb-endings	n5	01-n5	bunpro:polite-verb-endings			sk:auto/n5	djg:bunpro/polite-verb-endings	strict-deck; bunpro:polite-verb-endings; ます; Polite Verb Endings
v-まで	n5	01-n5	bunpro:v-まで			sk:auto/n5	djg:bunpro/v-まで	strict-deck; bunpro:v-まで; Verb + まで; Until (something) happens
verb-non-past	n5	01-n5	bunpro:verb-non-past			sk:auto/n5	djg:bunpro/verb-non-past	strict-deck; bunpro:verb-non-past; Verbs (Non-past); (Non-past)
verb-た-noun	n5	01-n5	bunpro:verb-た-noun			sk:auto/n5	djg:bunpro/verb-た-noun	strict-deck; bunpro:verb-た-noun; Verb［た・ている］+ Noun; Verb modified noun, Relative clause
verb-て	n5	01-n5	bunpro:verb-て			sk:auto/n5	djg:bunpro/verb-て	strict-deck; bunpro:verb-て; Verb + て; And, Then (Linking events)
verb-て-b	n5	01-n5	bunpro:verb-て-b			sk:auto/n5	djg:bunpro/verb-て-b	strict-deck; bunpro:verb-て-b; Verb + て+ B; And, And then, After that (sequence)
verb-てもいい	n5	01-n5	bunpro:verb-てもいい			sk:auto/n5	djg:bunpro/verb-てもいい	strict-deck; bunpro:verb-てもいい; Verb + てもいい; It's okay to, It's alright to, Can/may
verb-にいく	n5	01-n5	bunpro:verb-にいく			sk:auto/n5	djg:bunpro/verb-にいく	strict-deck; bunpro:verb-にいく; Verb + にいく; To go ~, To go in order to ~
あげる	n5	01-n5	bunpro:あげる			sk:auto/n5	djg:bunpro/あげる	strict-deck; bunpro:あげる; あげる; To give (away), To present, To provide
あそこ	n5	01-n5	bunpro:あそこ			sk:auto/n5	djg:bunpro/あそこ	strict-deck; bunpro:あそこ; あそこ; Over there
あの	n5	01-n5	bunpro:あの			sk:auto/n5	djg:bunpro/あの	strict-deck; bunpro:あの; あの; That (over there)
あれ	n5	01-n5	bunpro:あれ			sk:auto/n5	djg:bunpro/あれ	strict-deck; bunpro:あれ; あれ; That (over there)
い-Adjective-くなかった	n5	01-n5	bunpro:い-Adjective-くなかった			sk:auto/n5	djg:bunpro/い-Adjective-くなかった	strict-deck; bunpro:い-Adjective-くなかった; い-Adjective くなかった; Was not, Wasn't (Adjective)
い-adjective-noun	n5	01-n5	bunpro:い-adjective-noun			sk:auto/n5	djg:bunpro/い-adjective-noun	strict-deck; bunpro:い-adjective-noun; い-Adjective + Noun; Describing a noun
い-adjective-predicate	n5	01-n5	bunpro:い-adjective-predicate			sk:auto/n5	djg:bunpro/い-adjective-predicate	strict-deck; bunpro:い-adjective-predicate; い-Adjective (Predicate); い-Adjective (Predicate)
い-adjectives	n5	01-n5	bunpro:い-adjectives			sk:auto/n5	djg:bunpro/い-adjectives	strict-deck; bunpro:い-adjectives; い-Adjectives; Adjectives ending in い
いい	n5	01-n5	bunpro:いい			sk:auto/n5	djg:bunpro/いい	strict-deck; bunpro:いい; いい; い-Adjective meaning 'good'
う-Verbs	n5	01-n5	bunpro:う-Verbs			sk:auto/n5	djg:bunpro/う-Verbs	strict-deck; bunpro:う-Verbs; う-Verb (Dictionary); う + ます (Godan Verbs)
う-verb-neg-past	n5	01-n5	bunpro:う-verb-neg-past			sk:auto/n5	djg:bunpro/う-verb-neg-past	strict-deck; bunpro:う-verb-neg-past; う-Verb (Negative-Past); う - Verbs (Negative-past tense)
う-verb-past	n5	01-n5	bunpro:う-verb-past			sk:auto/n5	djg:bunpro/う-verb-past	strict-deck; bunpro:う-verb-past; う-Verb (Past); う - Verbs (Past tense)
うverb--ない	n5	01-n5	bunpro:うverb--ない			sk:auto/n5	djg:bunpro/うverb--ない	strict-deck; bunpro:うverb--ない; う-Verb (Negative); Will/Does/Do (not)
か	n5	01-n5	bunpro:か			sk:auto/n5	djg:bunpro/か	strict-deck; bunpro:か; か; Question marking particle
か-or	n5	01-n5	bunpro:か-or			sk:auto/n5	djg:bunpro/か-or	strict-deck; bunpro:か-or; か; Or
から	n5	01-n5	bunpro:から			sk:auto/n5	djg:bunpro/から	strict-deck; bunpro:から; から; From
から-because	n5	01-n5	bunpro:から-because			sk:auto/n5	djg:bunpro/から-because	strict-deck; bunpro:から-because; から; Because, Since
が	n5	01-n5	bunpro:が			sk:auto/n5	djg:bunpro/が	strict-deck; bunpro:が; が; Subject marking particle, Identification particle
が-but	n5	01-n5	bunpro:が-but			sk:auto/n5	djg:bunpro/が-but	strict-deck; bunpro:が-but; が; But, However
がある	n5	01-n5	bunpro:がある			sk:auto/n5	djg:bunpro/がある	strict-deck; bunpro:がある; がある; To be, There is
がある-noun	n5	01-n5	bunpro:がある-noun			sk:auto/n5	djg:bunpro/がある-noun	strict-deck; bunpro:がある-noun; がある + Noun; Noun (B) that has Noun (A), Noun (B) with Noun (A)
がいる	n5	01-n5	bunpro:がいる			sk:auto/n5	djg:bunpro/がいる	strict-deck; bunpro:がいる; がいる; To be, There is,  To remain (in a state)
きらい	n5	01-n5	bunpro:きらい			sk:auto/n5	djg:bunpro/きらい	strict-deck; bunpro:きらい; きらい; Dislike, Not fond of
くらい1	n5	01-n5	bunpro:くらい1			sk:auto/n5	djg:bunpro/くらい1	strict-deck; bunpro:くらい1; くらい ①; About, Approximately
くる	n5	01-n5	bunpro:くる			sk:auto/n5	djg:bunpro/くる	strict-deck; bunpro:くる; くる; To come
くれる	n5	01-n5	bunpro:くれる			sk:auto/n5	djg:bunpro/くれる	strict-deck; bunpro:くれる; くれる; To give (me), To be given
けっこう	n5	01-n5	bunpro:けっこう			sk:auto/n5	djg:bunpro/けっこう	strict-deck; bunpro:けっこう; けっこう; Quite, A lot, Fairly, Rather
けど-だけど	n5	01-n5	bunpro:けど-だけど			sk:auto/n5	djg:bunpro/けど-だけど	strict-deck; bunpro:けど-だけど; けど・だけど; But, However
けれども	n5	01-n5	bunpro:けれども			sk:auto/n5	djg:bunpro/けれども	strict-deck; bunpro:けれども; けれども; But, Although
ここ	n5	01-n5	bunpro:ここ			sk:auto/n5	djg:bunpro/ここ	strict-deck; bunpro:ここ; ここ; Here, This place
この	n5	01-n5	bunpro:この			sk:auto/n5	djg:bunpro/この	strict-deck; bunpro:この; この; This
これ	n5	01-n5	bunpro:これ			sk:auto/n5	djg:bunpro/これ	strict-deck; bunpro:これ; これ; This
じゃない	n5	01-n5	bunpro:じゃない			sk:auto/n5	djg:bunpro/じゃない	strict-deck; bunpro:じゃない; じゃない; Is not, Isn't
じゃなかった	n5	01-n5	bunpro:じゃなかった			sk:auto/n5	djg:bunpro/じゃなかった	strict-deck; bunpro:じゃなかった; じゃなかった; Was not, Wasn't
すき	n5	01-n5	bunpro:すき			sk:auto/n5	djg:bunpro/すき	strict-deck; bunpro:すき; 好き; Like, Fond of
すぎる	n5	01-n5	bunpro:すぎる			sk:auto/n5	djg:bunpro/すぎる	strict-deck; bunpro:すぎる; すぎる; Too much, Very
する	n5	01-n5	bunpro:する			sk:auto/n5	djg:bunpro/する	strict-deck; bunpro:する; する; To do, To make into
そこ	n5	01-n5	bunpro:そこ			sk:auto/n5	djg:bunpro/そこ	strict-deck; bunpro:そこ; そこ; There, That place
その	n5	01-n5	bunpro:その			sk:auto/n5	djg:bunpro/その	strict-deck; bunpro:その; その; That
それ	n5	01-n5	bunpro:それ			sk:auto/n5	djg:bunpro/それ	strict-deck; bunpro:それ; それ; That
たい	n5	01-n5	bunpro:たい			sk:auto/n5	djg:bunpro/たい	strict-deck; bunpro:たい; たい; Want to do
たくさん	n5	01-n5	bunpro:たくさん			sk:auto/n5	djg:bunpro/たくさん	strict-deck; bunpro:たくさん; たくさん; Many, A lot of, Plenty, Enough
たことがある	n5	01-n5	bunpro:たことがある			sk:auto/n5	djg:bunpro/たことがある	strict-deck; bunpro:たことがある; たことがある; Have done before
たほうがいい	n5	01-n5	bunpro:たほうがいい			sk:auto/n5	djg:bunpro/たほうがいい	strict-deck; bunpro:たほうがいい; たほうがいい; It'd be better to, Should do
たり-たりする	n5	01-n5	bunpro:たり-たりする			sk:auto/n5	djg:bunpro/たり-たりする	strict-deck; bunpro:たり-たりする; たり～たりする; Things like ~ and ~
だ	n5	01-n5	bunpro:だ			sk:auto/n5	djg:bunpro/だ	strict-deck; bunpro:だ; だ; To be, Is
だけ	n5	01-n5	bunpro:だけ			sk:auto/n5	djg:bunpro/だけ	strict-deck; bunpro:だけ; だけ; Only, Just
だった-でした	n5	01-n5	bunpro:だった-でした			sk:auto/n5	djg:bunpro/だった-でした	strict-deck; bunpro:だった-でした; だった・でした; Was, Were (Past tense)
だれ	n5	01-n5	bunpro:だれ			sk:auto/n5	djg:bunpro/だれ	strict-deck; bunpro:だれ; 誰; Who
だろう	n5	01-n5	bunpro:だろう			sk:auto/n5	djg:bunpro/だろう	strict-deck; bunpro:だろう; だろう; Right?, Probably, Isn't it?
って	n5	01-n5	bunpro:って			sk:auto/n5	djg:bunpro/って	strict-deck; bunpro:って; って; Casual quotation
つもりだ	n5	01-n5	bunpro:つもりだ			sk:auto/n5	djg:bunpro/つもりだ	strict-deck; bunpro:つもりだ; つもりだ; To plan to, To intend to
ている1	n5	01-n5	bunpro:ている1			sk:auto/n5	djg:bunpro/ている1	strict-deck; bunpro:ている1; ている①; Is, Am, Are (~ing)
ている2	n5	01-n5	bunpro:ている2			sk:auto/n5	djg:bunpro/ている2	strict-deck; bunpro:ている2; ている②; State of being, Has (have) done
ている3	n5	01-n5	bunpro:ている3			sk:auto/n5	djg:bunpro/ている3	strict-deck; bunpro:ている3; ている③; Has/have done, Is ~ing (Repetition)
てから	n5	01-n5	bunpro:てから			sk:auto/n5	djg:bunpro/てから	strict-deck; bunpro:てから; てから; Once...is done, Once...happens, After doing
てください	n5	01-n5	bunpro:てください			sk:auto/n5	djg:bunpro/てください	strict-deck; bunpro:てください; てください; Please do (Polite request)
てはいけない	n5	01-n5	bunpro:てはいけない			sk:auto/n5	djg:bunpro/てはいけない	strict-deck; bunpro:てはいけない; てはいけない; Must not, May not
てもいい	n5	01-n5	bunpro:てもいい			sk:auto/n5	djg:bunpro/てもいい	strict-deck; bunpro:てもいい; てもいい; It is alright/fine/okay even if, Can/may, ~ is also okay
で	n5	01-n5	bunpro:で			sk:auto/n5	djg:bunpro/で	strict-deck; bunpro:で; で; At, In
で-by	n5	01-n5	bunpro:で-by			sk:auto/n5	djg:bunpro/で-by	strict-deck; bunpro:で-by; で; With, By (using)
でしょう	n5	01-n5	bunpro:でしょう			sk:auto/n5	djg:bunpro/でしょう	strict-deck; bunpro:でしょう; でしょう; Right?, Probably, Isn't it?
です	n5	01-n5	bunpro:です			sk:auto/n5	djg:bunpro/です	strict-deck; bunpro:です; です; To be, Is
と	n5	01-n5	bunpro:と			sk:auto/n5	djg:bunpro/と	strict-deck; bunpro:と; と; Quotation
と-and	n5	01-n5	bunpro:と-and			sk:auto/n5	djg:bunpro/と-and	strict-deck; bunpro:と-and; と; And
と-with	n5	01-n5	bunpro:と-with			sk:auto/n5	djg:bunpro/と-with	strict-deck; bunpro:と-with; と; With
どうして	n5	01-n5	bunpro:どうして			sk:auto/n5	djg:bunpro/どうして	strict-deck; bunpro:どうして; どうして; Why
どこ	n5	01-n5	bunpro:どこ			sk:auto/n5	djg:bunpro/どこ	strict-deck; bunpro:どこ; どこ; Where
どの	n5	01-n5	bunpro:どの			sk:auto/n5	djg:bunpro/どの	strict-deck; bunpro:どの; どの; Which (of three or more), What (kind)
どれ	n5	01-n5	bunpro:どれ			sk:auto/n5	djg:bunpro/どれ	strict-deck; bunpro:どれ; どれ; Which (of three or more)
な	n5	01-n5	bunpro:な			sk:auto/n5	djg:bunpro/な	strict-deck; bunpro:な; な; Do not, Don't (Prohibitive)
な-adjective-noun	n5	01-n5	bunpro:な-adjective-noun			sk:auto/n5	djg:bunpro/な-adjective-noun	strict-deck; bunpro:な-adjective-noun; な-Adjective + Noun; Describing a noun
な-adjective-predicate	n5	01-n5	bunpro:な-adjective-predicate			sk:auto/n5	djg:bunpro/な-adjective-predicate	strict-deck; bunpro:な-adjective-predicate; な-Adjective だ; な-Adjective (Predicate)
な-adjectives	n5	01-n5	bunpro:な-adjectives			sk:auto/n5	djg:bunpro/な-adjectives	strict-deck; bunpro:な-adjectives; な-Adjectives; Adjectives that are also nouns
ないでください	n5	01-n5	bunpro:ないでください			sk:auto/n5	djg:bunpro/ないでください	strict-deck; bunpro:ないでください; ないでください; Please don't (Polite request)
ないほうがいい	n5	01-n5	bunpro:ないほうがいい			sk:auto/n5	djg:bunpro/ないほうがいい	strict-deck; bunpro:ないほうがいい; ないほうがいい; It'd be better not to, Shouldn't do
なくちゃ-なきゃ	n5	01-n5	bunpro:なくちゃ-なきゃ			sk:auto/n5	djg:bunpro/なくちゃ-なきゃ	strict-deck; bunpro:なくちゃ-なきゃ; なくちゃ・なきゃ; Must do, Have to do
なくてはいけない	n5	01-n5	bunpro:なくてはいけない			sk:auto/n5	djg:bunpro/なくてはいけない	strict-deck; bunpro:なくてはいけない; なくてはいけない; Must do, Have to do
なくてはならない	n5	01-n5	bunpro:なくてはならない			sk:auto/n5	djg:bunpro/なくてはならない	strict-deck; bunpro:なくてはならない; なくてはならない; Must do, Have to do
なぜ	n5	01-n5	bunpro:なぜ			sk:auto/n5	djg:bunpro/なぜ	strict-deck; bunpro:なぜ; なぜ; Why
なにか-なにも	n5	01-n5	bunpro:なにか-なにも			sk:auto/n5	djg:bunpro/なにか-なにも	strict-deck; bunpro:なにか-なにも; なにか・なにも; Something, Nothing, Anything, Not anything, Some kind of, Not any kind of
なんで	n5	01-n5	bunpro:なんで			sk:auto/n5	djg:bunpro/なんで	strict-deck; bunpro:なんで; なんで; Why
に	n5	01-n5	bunpro:に			sk:auto/n5	djg:bunpro/に	strict-deck; bunpro:に; に; In, At, To, For, On
にする	n5	01-n5	bunpro:にする			sk:auto/n5	djg:bunpro/にする	strict-deck; bunpro:にする; にする; To decide on, To choose, To make something into, To view something as
になる-くなる	n5	01-n5	bunpro:になる-くなる			sk:auto/n5	djg:bunpro/になる-くなる	strict-deck; bunpro:になる-くなる; ～になる・～くなる; To become (Adjective)
ね	n5	01-n5	bunpro:ね			sk:auto/n5	djg:bunpro/ね	strict-deck; bunpro:ね; ね; Isn't it?, Right? (Sentence ending particle)
の	n5	01-n5	bunpro:の			sk:auto/n5	djg:bunpro/の	strict-deck; bunpro:の; の; Indicates possession
の-noun-ommission	n5	01-n5	bunpro:の-noun-ommission			sk:auto/n5	djg:bunpro/の-noun-ommission	strict-deck; bunpro:の-noun-ommission; の; Possessive use (Noun omission)
の-questions	n5	01-n5	bunpro:の-questions			sk:auto/n5	djg:bunpro/の-questions	strict-deck; bunpro:の-questions; の (Questions); Contextual and Explanatory Questions
の-subject	n5	01-n5	bunpro:の-subject			sk:auto/n5	djg:bunpro/の-subject	strict-deck; bunpro:の-subject; が・の (Subject); Particle Swapping
のがじょうず	n5	01-n5	bunpro:のがじょうず			sk:auto/n5	djg:bunpro/のがじょうず	strict-deck; bunpro:のがじょうず; のがじょうず; To be good at, Proficient
のがすき	n5	01-n5	bunpro:のがすき			sk:auto/n5	djg:bunpro/のがすき	strict-deck; bunpro:のがすき; のがすき; Like doing, Love doing
のがへた	n5	01-n5	bunpro:のがへた			sk:auto/n5	djg:bunpro/のがへた	strict-deck; bunpro:のがへた; のがへた; To be bad at, Poor at, Unskillful
ので	n5	01-n5	bunpro:ので			sk:auto/n5	djg:bunpro/ので	strict-deck; bunpro:ので; ので; Because, So, Since, The reason being
のなかで-がいちばん	n5	01-n5	bunpro:のなかで-がいちばん			sk:auto/n5	djg:bunpro/のなかで-がいちばん	strict-deck; bunpro:のなかで-がいちばん; のなかで～がいちばん～; Out of ~, ~ is the best/most ~
のは	n5	01-n5	bunpro:のは			sk:auto/n5	djg:bunpro/のは	strict-deck; bunpro:のは; の; Verb nominalizer, The one who..., That which...
は	n5	01-n5	bunpro:は			sk:auto/n5	djg:bunpro/は	strict-deck; bunpro:は; は; As for... (Highlights sentence topic)
へ	n5	01-n5	bunpro:へ			sk:auto/n5	djg:bunpro/へ	strict-deck; bunpro:へ; へ; To, Toward
へいく	n5	01-n5	bunpro:へいく			sk:auto/n5	djg:bunpro/へいく	strict-deck; bunpro:へいく; へいく; To go to, To head toward
まえに	n5	01-n5	bunpro:まえに			sk:auto/n5	djg:bunpro/まえに	strict-deck; bunpro:まえに; まえに; Before, In front of
ましょう	n5	01-n5	bunpro:ましょう			sk:auto/n5	djg:bunpro/ましょう	strict-deck; bunpro:ましょう; ましょう; Let's, Shall we (Polite volitional)
ましょうか	n5	01-n5	bunpro:ましょうか			sk:auto/n5	djg:bunpro/ましょうか	strict-deck; bunpro:ましょうか; ～ましょうか; Shall we, Shall I
ませんか	n5	01-n5	bunpro:ませんか			sk:auto/n5	djg:bunpro/ませんか	strict-deck; bunpro:ませんか; ませんか; Won't you, Would you not, Why don't we
まだ	n5	01-n5	bunpro:まだ			sk:auto/n5	djg:bunpro/まだ	strict-deck; bunpro:まだ; まだ; Still
まだ-ていません	n5	01-n5	bunpro:まだ-ていません			sk:auto/n5	djg:bunpro/まだ-ていません	strict-deck; bunpro:まだ-ていません; まだ～ていません; Still haven't done (something)
も	n5	01-n5	bunpro:も			sk:auto/n5	djg:bunpro/も	strict-deck; bunpro:も; も; Also, Too, As well, Even, Either, Neither
もう	n5	01-n5	bunpro:もう			sk:auto/n5	djg:bunpro/もう	strict-deck; bunpro:もう; もう; Already, Anymore
もらう	n5	01-n5	bunpro:もらう			sk:auto/n5	djg:bunpro/もらう	strict-deck; bunpro:もらう; もらう; To receive, To get, To obtain
や	n5	01-n5	bunpro:や			sk:auto/n5	djg:bunpro/や	strict-deck; bunpro:や; や; Things like, And the like
よ	n5	01-n5	bunpro:よ			sk:auto/n5	djg:bunpro/よ	strict-deck; bunpro:よ; よ; Emphasis (Sentence ending particle)
より-のほうが	n5	01-n5	bunpro:より-のほうが			sk:auto/n5	djg:bunpro/より-のほうが	strict-deck; bunpro:より-のほうが; より～のほうが; To be more ~ than ~
る-Verbs	n5	01-n5	bunpro:る-Verbs			sk:auto/n5	djg:bunpro/る-Verbs	strict-deck; bunpro:る-Verbs; る-Verb (Dictionary); る + ます (Ichidan Verbs)
る-verb-neg-past	n5	01-n5	bunpro:る-verb-neg-past			sk:auto/n5	djg:bunpro/る-verb-neg-past	strict-deck; bunpro:る-verb-neg-past; る-Verb (Negative-Past); る - Verbs (Negative-past tense)
る-verb-past	n5	01-n5	bunpro:る-verb-past			sk:auto/n5	djg:bunpro/る-verb-past	strict-deck; bunpro:る-verb-past; る-Verb (Past); る - Verbs (Past tense)
るverb-ない	n5	01-n5	bunpro:るverb-ない			sk:auto/n5	djg:bunpro/るverb-ない	strict-deck; bunpro:るverb-ない; る-Verb (Negative); Will/Does/Do (not)
を	n5	01-n5	bunpro:を			sk:auto/n5	djg:bunpro/を	strict-deck; bunpro:を; を; Object marking particle
誰か-どこか-誰も-どこも	n5	01-n5	bunpro:誰か-どこか-誰も-どこも			sk:auto/n5	djg:bunpro/誰か-どこか-誰も-どこも	strict-deck; bunpro:誰か-どこか-誰も-どこも; 誰か・どこか・誰も・どこも; Someone, Somewhere, Not anyone, Not anywhere
Verb[passive]	n4	02-n4	bunpro:Verb[passive]			sk:auto/n4	djg:bunpro/Verb[passive]	strict-deck; bunpro:Verb[passive]; Verb［れる・られる］; Was done to ~ by ~, Done without consent, Done to one's dismay
Verb[potential]	n4	02-n4	bunpro:Verb[potential]			sk:auto/n4	djg:bunpro/Verb[potential]	strict-deck; bunpro:Verb[potential]; れる・られる (Potential); To be able, Can (Potential)
causative	n4	02-n4	bunpro:causative			sk:auto/n4	djg:bunpro/causative	strict-deck; bunpro:causative; Verb［せる・させる］; To make/let/have (somebody do something)
causative-passive	n4	02-n4	bunpro:causative-passive			sk:auto/n4	djg:bunpro/causative-passive	strict-deck; bunpro:causative-passive; Causative-Passive; Verbs (Causative-passive voice), To be made to do something, To be forced to do
describing-verbs	n4	02-n4	bunpro:describing-verbs			sk:auto/n4	djg:bunpro/describing-verbs	strict-deck; bunpro:describing-verbs; く・に; ～ly (Describing verbs), Adverbs
number-amount-は	n4	02-n4	bunpro:number-amount-は			sk:auto/n4	djg:bunpro/number-amount-は	strict-deck; bunpro:number-amount-は; Number/Amount + は; At least, Sort of, Or so
number-しか-ない	n4	02-n4	bunpro:number-しか-ない			sk:auto/n4	djg:bunpro/number-しか-ない	strict-deck; bunpro:number-しか-ない; Number + しか〜ない; No more than, Not exceeding, As few as・as little as, Only
number-も	n4	02-n4	bunpro:number-も			sk:auto/n4	djg:bunpro/number-も	strict-deck; bunpro:number-も; Number + も; Emphasis, As ~ as, Not even
question-phrase-か	n4	02-n4	bunpro:question-phrase-か			sk:auto/n4	djg:bunpro/question-phrase-か	strict-deck; bunpro:question-phrase-か; Question-phrase + か; Including questions within sentences
transitive-intransitive-verbs	n4	02-n4	bunpro:transitive-intransitive-verbs			sk:auto/n4	djg:bunpro/transitive-intransitive-verbs	strict-deck; bunpro:transitive-intransitive-verbs; 他動詞・自動詞; Done through action vs. occurring on its own
verb-て-noun-で-b	n4	02-n4	bunpro:verb-て-noun-で-b			sk:auto/n4	djg:bunpro/verb-て-noun-で-b	strict-deck; bunpro:verb-て-noun-で-b; Verb[て]・Noun[で] + B; By, With, On, By means of, ~ing with
verb-ないで	n4	02-n4	bunpro:verb-ないで			sk:auto/n4	djg:bunpro/verb-ないで	strict-deck; bunpro:verb-ないで; Verb[ないで]; (Please) do not (for me), Casual request
verbて-b	n4	02-n4	bunpro:verbて-b			sk:auto/n4	djg:bunpro/verbて-b	strict-deck; bunpro:verbて-b; Verb[て] + B; Non-sequence, And, But (Contrast), Parallel action/state
verbて-b2	n4	02-n4	bunpro:verbて-b2			sk:auto/n4	djg:bunpro/verbて-b2	strict-deck; bunpro:verbて-b2; Verb[て] + B; And・and so, Due to, Because of, Since, Conjunctive
verbて-request	n4	02-n4	bunpro:verbて-request			sk:auto/n4	djg:bunpro/verbて-request	strict-deck; bunpro:verbて-request; Verb[て]; Please do for me (Casual request)
あとで	n4	02-n4	bunpro:あとで			sk:auto/n4	djg:bunpro/あとで	strict-deck; bunpro:あとで; あとで; After, Later
あまり-ない	n4	02-n4	bunpro:あまり-ない			sk:auto/n4	djg:bunpro/あまり-ない	strict-deck; bunpro:あまり-ない; あまり～ない; Not very, Not much, Not really, Hardly
いか	n4	02-n4	bunpro:いか			sk:auto/n4	djg:bunpro/いか	strict-deck; bunpro:いか; いか; Less than (or equal to), Under・(and) below, Any less・fewer, Not exceeding
いがい	n4	02-n4	bunpro:いがい			sk:auto/n4	djg:bunpro/いがい	strict-deck; bunpro:いがい; いがい; Except・besides, Other than, With the exception of
いたす	n4	02-n4	bunpro:いたす			sk:auto/n4	djg:bunpro/いたす	strict-deck; bunpro:いたす; いたす; To do (Humble), To venerably do
いらっしゃる	n4	02-n4	bunpro:いらっしゃる			sk:auto/n4	djg:bunpro/いらっしゃる	strict-deck; bunpro:いらっしゃる; いらっしゃる; To be (Honorific), To come (Honorific), To go (Honorific)
お-ください	n4	02-n4	bunpro:お-ください			sk:auto/n4	djg:bunpro/お-ください	strict-deck; bunpro:お-ください; お～ください ; Please do (Honorific)
お-する	n4	02-n4	bunpro:お-する			sk:auto/n4	djg:bunpro/お-する	strict-deck; bunpro:お-する; お〜する; I humbly do, I am obliged to do, Humble speech
お-になる	n4	02-n4	bunpro:お-になる			sk:auto/n4	djg:bunpro/お-になる	strict-deck; bunpro:お-になる; お～になる ; To do (Honorific)
おわる	n4	02-n4	bunpro:おわる			sk:auto/n4	djg:bunpro/おわる	strict-deck; bunpro:おわる; おわる; To finish, To end
かい	n4	02-n4	bunpro:かい			sk:auto/n4	djg:bunpro/かい	strict-deck; bunpro:かい; かい; Question marker
かかる-time-cost	n4	02-n4	bunpro:かかる-time-cost			sk:auto/n4	djg:bunpro/かかる-time-cost	strict-deck; bunpro:かかる-time-cost; かかる (Time/Price); Costs (money), Takes (time)
かしら	n4	02-n4	bunpro:かしら			sk:auto/n4	djg:bunpro/かしら	strict-deck; bunpro:かしら; かしら; I wonder
かた	n4	02-n4	bunpro:かた			sk:auto/n4	djg:bunpro/かた	strict-deck; bunpro:かた; かた; Way of ~ing, How to ~, Manner of ~ing
かどうか	n4	02-n4	bunpro:かどうか			sk:auto/n4	djg:bunpro/かどうか	strict-deck; bunpro:かどうか; かどうか; Whether or not, If...or not
かな	n4	02-n4	bunpro:かな			sk:auto/n4	djg:bunpro/かな	strict-deck; bunpro:かな; かな; I wonder
かもしれない	n4	02-n4	bunpro:かもしれない			sk:auto/n4	djg:bunpro/かもしれない	strict-deck; bunpro:かもしれない; かもしれない; Might, Maybe, Probably
がする	n4	02-n4	bunpro:がする			sk:auto/n4	djg:bunpro/がする	strict-deck; bunpro:がする; がする; To give off, Smell, Sound, Taste, Sensation
がひつよう	n4	02-n4	bunpro:がひつよう			sk:auto/n4	djg:bunpro/がひつよう	strict-deck; bunpro:がひつよう; がひつよう; Need, Necessary
がほしい	n4	02-n4	bunpro:がほしい			sk:auto/n4	djg:bunpro/がほしい	strict-deck; bunpro:がほしい; がほしい; To want something, To be in need of
