#columns:point_slug	jlpt	module	bunpro_id	tofugu_url	imabi_url	shinkanzen_ref	djg_page	notes
というものでもない	n2	04-n2	bunpro:というものでもない			sk:auto/n2	djg:bunpro/というものでもない	strict-deck; bunpro:というものでもない; というものでもない; There is no guarantee that…, Not necessarily
というわけではない	n2	04-n2	bunpro:というわけではない			sk:auto/n2	djg:bunpro/というわけではない	strict-deck; bunpro:というわけではない; というわけではない; It is not that, It doesn't mean that, It is not always the case
という点から考えると	n2	04-n2	bunpro:という点から考えると			sk:auto/n2	djg:bunpro/という点から考えると	strict-deck; bunpro:という点から考えると; という点から考えると; From the standpoint of, From the perspective of, From the viewpoint of, Think in terms of, Viewed from the angle of
という風に	n2	04-n2	bunpro:という風に			sk:auto/n2	djg:bunpro/という風に	strict-deck; bunpro:という風に; という風に; As if to say, As if to suggest that, In such a way that, Things like
といった	n2	04-n2	bunpro:といった			sk:auto/n2	djg:bunpro/といった	strict-deck; bunpro:といった; といった; Such as, Like, So much as
とか	n2	04-n2	bunpro:とか			sk:auto/n2	djg:bunpro/とか	strict-deck; bunpro:とか; とか; I heard that… something like, They said ... or something
ところだった2	n2	04-n2	bunpro:ところだった2			sk:auto/n2	djg:bunpro/ところだった2	strict-deck; bunpro:ところだった2; ところだった ②; Was just about to do something, Was in the middle of...
ところを見ると	n2	04-n2	bunpro:ところを見ると			sk:auto/n2	djg:bunpro/ところを見ると	strict-deck; bunpro:ところを見ると; ところを見ると; Judging from, Seeing that
としては	n2	04-n2	bunpro:としては			sk:auto/n2	djg:bunpro/としては	strict-deck; bunpro:としては; としては; As a, For a, As for
としても	n2	04-n2	bunpro:としても			sk:auto/n2	djg:bunpro/としても	strict-deck; bunpro:としても; としても; Even if (we assume), Assuming,  Also as
とっくに	n2	04-n2	bunpro:とっくに			sk:auto/n2	djg:bunpro/とっくに	strict-deck; bunpro:とっくに; とっくに; Already, A long time ago, Long ago
とも	n2	04-n2	bunpro:とも			sk:auto/n2	djg:bunpro/とも	strict-deck; bunpro:とも; とも; Even if, No matter
と考えられる	n2	04-n2	bunpro:と考えられる			sk:auto/n2	djg:bunpro/と考えられる	strict-deck; bunpro:と考えられる; と考えられる; Can be considered as, Is thought to be, One can think that, It is conceivable that
どうせ	n2	04-n2	bunpro:どうせ			sk:auto/n2	djg:bunpro/どうせ	strict-deck; bunpro:どうせ; どうせ; Anyhow, At any rate, In any case, I have no doubt that, Probably
どうやら	n2	04-n2	bunpro:どうやら			sk:auto/n2	djg:bunpro/どうやら	strict-deck; bunpro:どうやら; どうやら; Apparently, Looks Like, Seems like
どころではない	n2	04-n2	bunpro:どころではない			sk:auto/n2	djg:bunpro/どころではない	strict-deck; bunpro:どころではない; どころではない; This is not the time for…, Far from, Out of the question
ないことには-ない	n2	04-n2	bunpro:ないことには-ない			sk:auto/n2	djg:bunpro/ないことには-ない	strict-deck; bunpro:ないことには-ない; ないことには～ない; Unless you do something
ないではいられない	n2	04-n2	bunpro:ないではいられない			sk:auto/n2	djg:bunpro/ないではいられない	strict-deck; bunpro:ないではいられない; ないではいられない; Cannot help doing something, Cannot resist doing something
ないわけにはいかない	n2	04-n2	bunpro:ないわけにはいかない			sk:auto/n2	djg:bunpro/ないわけにはいかない	strict-deck; bunpro:ないわけにはいかない; ないわけにはいかない; Can't not, No way to avoid
なお1	n2	04-n2	bunpro:なお1			sk:auto/n2	djg:bunpro/なお1	strict-deck; bunpro:なお1; なお①; Still, Even, Yet
なお2	n2	04-n2	bunpro:なお2			sk:auto/n2	djg:bunpro/なお2	strict-deck; bunpro:なお2; なお②; In addition, Incidentally, Furthermore, Moreover
なくはない	n2	04-n2	bunpro:なくはない			sk:auto/n2	djg:bunpro/なくはない	strict-deck; bunpro:なくはない; なくはない; It's not that…, Kind of, might, Slightly, Somewhat, In some respects
なにやら	n2	04-n2	bunpro:なにやら			sk:auto/n2	djg:bunpro/なにやら	strict-deck; bunpro:なにやら; なにやら; Something (or other), Some kind of
ならともかく	n2	04-n2	bunpro:ならともかく			sk:auto/n2	djg:bunpro/ならともかく	strict-deck; bunpro:ならともかく; ならともかく; If it's (A), sure, but (B), Putting aside (A), (B)
にあたり-にあたって	n2	04-n2	bunpro:にあたり-にあたって			sk:auto/n2	djg:bunpro/にあたり-にあたって	strict-deck; bunpro:にあたり-にあたって; にあたり・にあたって; When, When doing something, On the occasion, At the time
にかかわらず	n2	04-n2	bunpro:にかかわらず			sk:auto/n2	djg:bunpro/にかかわらず	strict-deck; bunpro:にかかわらず; にかかわらず; Regardless of, Whether or, No matter, With or without
にかかわる	n2	04-n2	bunpro:にかかわる			sk:auto/n2	djg:bunpro/にかかわる	strict-deck; bunpro:にかかわる; にかかわる; To relate to, To have to do with, Concerning, Depends on
にかけては	n2	04-n2	bunpro:にかけては			sk:auto/n2	djg:bunpro/にかけては	strict-deck; bunpro:にかけては; にかけては; When it comes to, Regarding, Concerning
にしたがって	n2	04-n2	bunpro:にしたがって			sk:auto/n2	djg:bunpro/にしたがって	strict-deck; bunpro:にしたがって; にしたがって; As, Following, As then, According to, In accordance with
にしたら	n2	04-n2	bunpro:にしたら			sk:auto/n2	djg:bunpro/にしたら	strict-deck; bunpro:にしたら; にしたら; From the point of view of
にしても-にしても	n2	04-n2	bunpro:にしても-にしても			sk:auto/n2	djg:bunpro/にしても-にしても	strict-deck; bunpro:にしても-にしても; にしても～にしても; Regardless of whether
にしろ-にしろ	n2	04-n2	bunpro:にしろ-にしろ			sk:auto/n2	djg:bunpro/にしろ-にしろ	strict-deck; bunpro:にしろ-にしろ; にしろ～にしろ; Whether… or
にすぎない	n2	04-n2	bunpro:にすぎない			sk:auto/n2	djg:bunpro/にすぎない	strict-deck; bunpro:にすぎない; にすぎない; No more than, Just, Merely
にせよ-にしろ	n2	04-n2	bunpro:にせよ-にしろ			sk:auto/n2	djg:bunpro/にせよ-にしろ	strict-deck; bunpro:にせよ-にしろ; にせよ・にしろ; Even if, Even though, No matter, Whether… or
につき	n2	04-n2	bunpro:につき			sk:auto/n2	djg:bunpro/につき	strict-deck; bunpro:につき; につき; Due to, On account of, Each or every
につけ	n2	04-n2	bunpro:につけ			sk:auto/n2	djg:bunpro/につけ	strict-deck; bunpro:につけ; につけ; Whenever, Every time something happens
にて	n2	04-n2	bunpro:にて			sk:auto/n2	djg:bunpro/にて	strict-deck; bunpro:にて; にて; In, At, With, Using, By
には	n2	04-n2	bunpro:には			sk:auto/n2	djg:bunpro/には	strict-deck; bunpro:には; には; In order to, In regard to, For
にほかならない	n2	04-n2	bunpro:にほかならない			sk:auto/n2	djg:bunpro/にほかならない	strict-deck; bunpro:にほかならない; にほかならない; Nothing but, None other than, Simply
にもかかわらず	n2	04-n2	bunpro:にもかかわらず			sk:auto/n2	djg:bunpro/にもかかわらず	strict-deck; bunpro:にもかかわらず; にもかかわらず; Despite, In spite of, Regardless, Nevertheless
にわたって	n2	04-n2	bunpro:にわたって			sk:auto/n2	djg:bunpro/にわたって	strict-deck; bunpro:にわたって; にわたって; Across, Throughout, Extends, Over (a period of time or range)
に伴って-に伴い	n2	04-n2	bunpro:に伴って-に伴い			sk:auto/n2	djg:bunpro/に伴って-に伴い	strict-deck; bunpro:に伴って-に伴い; に伴って・に伴い; As, Due,  Along with, Hand-in-hand with, Resulted in, Be consequent upon
に値する	n2	04-n2	bunpro:に値する			sk:auto/n2	djg:bunpro/に値する	strict-deck; bunpro:に値する; ～に値する; Be worthy of, Deserving of, Amounts to
に先立ち	n2	04-n2	bunpro:に先立ち			sk:auto/n2	djg:bunpro/に先立ち	strict-deck; bunpro:に先立ち; に先立ち; Before, Prior to, In preference over
に加えて	n2	04-n2	bunpro:に加えて			sk:auto/n2	djg:bunpro/に加えて	strict-deck; bunpro:に加えて; に加えて; Not only...but also, In addition, Not to mention
に反して	n2	04-n2	bunpro:に反して			sk:auto/n2	djg:bunpro/に反して	strict-deck; bunpro:に反して; に反して; Go against, Contrary to
に向かって-に向けて	n2	04-n2	bunpro:に向かって-に向けて			sk:auto/n2	djg:bunpro/に向かって-に向けて	strict-deck; bunpro:に向かって-に向けて; に向かって・に向けて; Towards, To face, To head to
に応えて	n2	04-n2	bunpro:に応えて			sk:auto/n2	djg:bunpro/に応えて	strict-deck; bunpro:に応えて; に応えて; In response to, Meet
に応じて	n2	04-n2	bunpro:に応じて			sk:auto/n2	djg:bunpro/に応じて	strict-deck; bunpro:に応じて; に応じて; Depending or based on, According to, In response to, Suitable for or to
に気をつける	n2	04-n2	bunpro:に気をつける			sk:auto/n2	djg:bunpro/に気をつける	strict-deck; bunpro:に気をつける; に気をつける; Take care, Be careful, Pay attention, Make sure, Watch out
に決まっている	n2	04-n2	bunpro:に決まっている			sk:auto/n2	djg:bunpro/に決まっている	strict-deck; bunpro:に決まっている; に決まっている; Surely, Bound to, Certainly, Be decided
に沿って	n2	04-n2	bunpro:に沿って			sk:auto/n2	djg:bunpro/に沿って	strict-deck; bunpro:に沿って; に沿って; Along, In accordance with, In line with
に相違ない	n2	04-n2	bunpro:に相違ない			sk:auto/n2	djg:bunpro/に相違ない	strict-deck; bunpro:に相違ない; に相違ない; Without a doubt, Certainly, Surely, Not mistaken
に越したことはない	n2	04-n2	bunpro:に越したことはない			sk:auto/n2	djg:bunpro/に越したことはない	strict-deck; bunpro:に越したことはない; に越したことはない; There is nothing better than, It is the best, Would be the best
に限って	n2	04-n2	bunpro:に限って			sk:auto/n2	djg:bunpro/に限って	strict-deck; bunpro:に限って; に限って; Particularly when, Those who, Only when
に限らず	n2	04-n2	bunpro:に限らず			sk:auto/n2	djg:bunpro/に限らず	strict-deck; bunpro:に限らず; に限らず; Not just, Not only… but also
に際して	n2	04-n2	bunpro:に際して			sk:auto/n2	djg:bunpro/に際して	strict-deck; bunpro:に際して; に際して; On the occasion of, At the time of
ぬ	n2	04-n2	bunpro:ぬ			sk:auto/n2	djg:bunpro/ぬ	strict-deck; bunpro:ぬ; ぬ; Classical negative, Classical verb [ない]
ねばならない	n2	04-n2	bunpro:ねばならない			sk:auto/n2	djg:bunpro/ねばならない	strict-deck; bunpro:ねばならない; ねばならない; Must, Have to, Should
のではないだろうか	n2	04-n2	bunpro:のではないだろうか			sk:auto/n2	djg:bunpro/のではないだろうか	strict-deck; bunpro:のではないだろうか; のではないだろうか; I think ... isn't it?, It might be that..., Don't you agree?
のみ	n2	04-n2	bunpro:のみ			sk:auto/n2	djg:bunpro/のみ	strict-deck; bunpro:のみ; のみ; Only (formal)
のみならず	n2	04-n2	bunpro:のみならず			sk:auto/n2	djg:bunpro/のみならず	strict-deck; bunpro:のみならず; のみならず; Not only...but, Not just...but, What is more
のももっともだ	n2	04-n2	bunpro:のももっともだ			sk:auto/n2	djg:bunpro/のももっともだ	strict-deck; bunpro:のももっともだ; のももっともだ; May well, Have or has good reason for, No wonder, … Is only natural
のも当然だ	n2	04-n2	bunpro:のも当然だ			sk:auto/n2	djg:bunpro/のも当然だ	strict-deck; bunpro:のも当然だ; のも当然だ; It is only natural that, It is no wonder
の下で	n2	04-n2	bunpro:の下で			sk:auto/n2	djg:bunpro/の下で	strict-deck; bunpro:の下で; の下で; Under, Under the supervision of, On the basis of
はたして	n2	04-n2	bunpro:はたして			sk:auto/n2	djg:bunpro/はたして	strict-deck; bunpro:はたして; はたして; Wonder if ~ (really)?, Wonder how ~ (actually)?, Sure enough, As expected
はともかく	n2	04-n2	bunpro:はともかく			sk:auto/n2	djg:bunpro/はともかく	strict-deck; bunpro:はともかく; はともかく; Setting aside, Apart from
はもとより	n2	04-n2	bunpro:はもとより			sk:auto/n2	djg:bunpro/はもとより	strict-deck; bunpro:はもとより; はもとより; Not only... but also, Let alone, Of course
は別として	n2	04-n2	bunpro:は別として			sk:auto/n2	djg:bunpro/は別として	strict-deck; bunpro:は別として; は別として; Apart from, (Setting) aside, Whether or, Except for, Save for
ふうに	n2	04-n2	bunpro:ふうに			sk:auto/n2	djg:bunpro/ふうに	strict-deck; bunpro:ふうに; ふうに; ~ way, In a way that suggests, Like ~
ぶりに	n2	04-n2	bunpro:ぶりに			sk:auto/n2	djg:bunpro/ぶりに	strict-deck; bunpro:ぶりに; ぶりに; For the first time in, Haven't done for some time
まい	n2	04-n2	bunpro:まい			sk:auto/n2	djg:bunpro/まい	strict-deck; bunpro:まい; まい; Won't, Intend not to, Probably not
も-ば-も	n2	04-n2	bunpro:も-ば-も			sk:auto/n2	djg:bunpro/も-ば-も	strict-deck; bunpro:も-ば-も; も～ば～も; …And…, Both ... and ..., ... And ... as well
もかまわず	n2	04-n2	bunpro:もかまわず			sk:auto/n2	djg:bunpro/もかまわず	strict-deck; bunpro:もかまわず; も構わず; Without worrying about
ものか	n2	04-n2	bunpro:ものか			sk:auto/n2	djg:bunpro/ものか	strict-deck; bunpro:ものか; ものか; Definitely not, Absolutely not, Impossible, Do you really think~?
ものがある	n2	04-n2	bunpro:ものがある			sk:auto/n2	djg:bunpro/ものがある	strict-deck; bunpro:ものがある; ものがある; Strong judgement, There is something, Feel strongly that
ものだから	n2	04-n2	bunpro:ものだから			sk:auto/n2	djg:bunpro/ものだから	strict-deck; bunpro:ものだから; ものだから; Because, The reason is
ものですから-もので	n2	04-n2	bunpro:ものですから-もので			sk:auto/n2	djg:bunpro/ものですから-もので	strict-deck; bunpro:ものですから-もので; ものですから・もので; Because, My excuse is, My explanation is
ものなら①	n2	04-n2	bunpro:ものなら①			sk:auto/n2	djg:bunpro/ものなら①	strict-deck; bunpro:ものなら①; ものなら①; If, If one could, If something would be possible
ものの	n2	04-n2	bunpro:ものの			sk:auto/n2	djg:bunpro/ものの	strict-deck; bunpro:ものの; ものの; Although, But, Even Though
も又	n2	04-n2	bunpro:も又			sk:auto/n2	djg:bunpro/も又	strict-deck; bunpro:も又; も又; Too, Also (with more emphasis than も alone), Again
やがて	n2	04-n2	bunpro:やがて			sk:auto/n2	djg:bunpro/やがて	strict-deck; bunpro:やがて; やがて; Before long, All too soon, In the end, Eventually
やら-やら	n2	04-n2	bunpro:やら-やら			sk:auto/n2	djg:bunpro/やら-やら	strict-deck; bunpro:やら-やら; やら～やら; Whether or, Things like, And … so on
ようがない・ようもない	n2	04-n2	bunpro:ようがない・ようもない			sk:auto/n2	djg:bunpro/ようがない・ようもない	strict-deck; bunpro:ようがない・ようもない; ようがない・ようもない; There's no way to, It's impossible to
ようでは-ようじゃ	n2	04-n2	bunpro:ようでは-ようじゃ			sk:auto/n2	djg:bunpro/ようでは-ようじゃ	strict-deck; bunpro:ようでは-ようじゃ; ようでは・ようじゃ; If, If it is true that
ようではないか	n2	04-n2	bunpro:ようではないか			sk:auto/n2	djg:bunpro/ようではないか	strict-deck; bunpro:ようではないか; 〜ようではないか; Let's do something, Why don't we
よりしかたがない	n2	04-n2	bunpro:よりしかたがない			sk:auto/n2	djg:bunpro/よりしかたがない	strict-deck; bunpro:よりしかたがない; よりしかたがない; There is no choice but, Can't be helped, Inevitable
よりほかない	n2	04-n2	bunpro:よりほかない			sk:auto/n2	djg:bunpro/よりほかない	strict-deck; bunpro:よりほかない; よりほかない; To have no choice but, No other way than, Have to
を-に任せる	n2	04-n2	bunpro:を-に任せる			sk:auto/n2	djg:bunpro/を-に任せる	strict-deck; bunpro:を-に任せる; ～を～に任せる; Leave 〜 up to, Entrust 〜 to
をもとに	n2	04-n2	bunpro:をもとに			sk:auto/n2	djg:bunpro/をもとに	strict-deck; bunpro:をもとに; をもとに; Based on, From, According to
を中心に	n2	04-n2	bunpro:を中心に			sk:auto/n2	djg:bunpro/を中心に	strict-deck; bunpro:を中心に; を中心に; Focused on, Centered on or around, Mainly, Most notably
を問わず	n2	04-n2	bunpro:を問わず			sk:auto/n2	djg:bunpro/を問わず	strict-deck; bunpro:を問わず; を問わず; Regardless of, Whether or not, No matter, With or without
を契機に	n2	04-n2	bunpro:を契機に			sk:auto/n2	djg:bunpro/を契機に	strict-deck; bunpro:を契機に; を契機に; Lead to, As a good opportunity to, As a result of, As a trigger
を巡って	n2	04-n2	bunpro:を巡って			sk:auto/n2	djg:bunpro/を巡って	strict-deck; bunpro:を巡って; を巡って; Concerning, In regard to, About, (Split) over
を込めて	n2	04-n2	bunpro:を込めて			sk:auto/n2	djg:bunpro/を込めて	strict-deck; bunpro:を込めて; を込めて; Full of, Filled with, With ～
を通じて-を通して	n2	04-n2	bunpro:を通じて-を通して			sk:auto/n2	djg:bunpro/を通じて-を通して	strict-deck; bunpro:を通じて-を通して; を通じて・を通して; Through, Via, Throughout
を除いて	n2	04-n2	bunpro:を除いて			sk:auto/n2	djg:bunpro/を除いて	strict-deck; bunpro:を除いて; を除いて; Except, With the exception of, Unless
一応1	n2	04-n2	bunpro:一応1			sk:auto/n2	djg:bunpro/一応1	strict-deck; bunpro:一応1; 一応 ①; Just in case, Just to be sure
一応2	n2	04-n2	bunpro:一応2			sk:auto/n2	djg:bunpro/一応2	strict-deck; bunpro:一応2; 一応 ②; more or less, for the time being, tentatively, roughly
一旦	n2	04-n2	bunpro:一旦			sk:auto/n2	djg:bunpro/一旦	strict-deck; bunpro:一旦; 一旦; Once …, If … for a short time, Temporarily (stop), For now or the time being
万が一	n2	04-n2	bunpro:万が一			sk:auto/n2	djg:bunpro/万が一	strict-deck; bunpro:万が一; 万が一; Just in case, In the worst-case scenario, In the unlikely event, By any chance
上	n2	04-n2	bunpro:上			sk:auto/n2	djg:bunpro/上	strict-deck; bunpro:上; 上; From the standpoint of
上に	n2	04-n2	bunpro:上に			sk:auto/n2	djg:bunpro/上に	strict-deck; bunpro:上に; 上に; As well, Besides, In addition to
上は	n2	04-n2	bunpro:上は			sk:auto/n2	djg:bunpro/上は	strict-deck; bunpro:上は; 上は; Once, Since, Now that, As long as
中を	n2	04-n2	bunpro:中を			sk:auto/n2	djg:bunpro/中を	strict-deck; bunpro:中を; 中を; In, On, Into, Inside of
以上2	n2	04-n2	bunpro:以上2			sk:auto/n2	djg:bunpro/以上2	strict-deck; bunpro:以上2; 以上 ②; Since, Now that, As long as, If
以上に	n2	04-n2	bunpro:以上に			sk:auto/n2	djg:bunpro/以上に	strict-deck; bunpro:以上に; 以上に; More than, No less than, Even more
以来	n2	04-n2	bunpro:以来			sk:auto/n2	djg:bunpro/以来	strict-deck; bunpro:以来; 以来; Since, Henceforth
何から何まで	n2	04-n2	bunpro:何から何まで			sk:auto/n2	djg:bunpro/何から何まで	strict-deck; bunpro:何から何まで; 何から何まで; Everything and anything, From A to Z, From head to toe, Everything
何しろ	n2	04-n2	bunpro:何しろ			sk:auto/n2	djg:bunpro/何しろ	strict-deck; bunpro:何しろ; 何しろ; No wonder, After all, In fact, Because, At any rate
何といっても	n2	04-n2	bunpro:何といっても			sk:auto/n2	djg:bunpro/何といっても	strict-deck; bunpro:何といっても; 何といっても; By any account, All the same, No doubt
何より	n2	04-n2	bunpro:何より			sk:auto/n2	djg:bunpro/何より	strict-deck; bunpro:何より; 何より; Be glad, Be relieved, Most, Best, Above all else, More than anything
傾向がある	n2	04-n2	bunpro:傾向がある			sk:auto/n2	djg:bunpro/傾向がある	strict-deck; bunpro:傾向がある; 傾向がある; Tendency, Trend, Inclination
僅かに	n2	04-n2	bunpro:僅かに			sk:auto/n2	djg:bunpro/僅かに	strict-deck; bunpro:僅かに; 僅かに; Only, Slightly, A little, Barely, Merely
反面	n2	04-n2	bunpro:反面			sk:auto/n2	djg:bunpro/反面	strict-deck; bunpro:反面; 反面; While, On the other hand, Although, However, On the flip side
幸い-幸いなことに	n2	04-n2	bunpro:幸い-幸いなことに			sk:auto/n2	djg:bunpro/幸い-幸いなことに	strict-deck; bunpro:幸い-幸いなことに; 幸い・幸いなことに; Luckily, Fortunately
弱	n2	04-n2	bunpro:弱			sk:auto/n2	djg:bunpro/弱	strict-deck; bunpro:弱; 弱; Just less than
強	n2	04-n2	bunpro:強			sk:auto/n2	djg:bunpro/強	strict-deck; bunpro:強; 強; Just more than
後-のnoun	n2	04-n2	bunpro:後-のnoun			sk:auto/n2	djg:bunpro/後-のnoun	strict-deck; bunpro:後-のnoun; 後(の) Noun; …left, Rest, Remaining, In, …to, …else
得ない	n2	04-n2	bunpro:得ない			sk:auto/n2	djg:bunpro/得ない	strict-deck; bunpro:得ない; 〜得ない; Unable to, Cannot
得る-得る	n2	04-n2	bunpro:得る-得る			sk:auto/n2	djg:bunpro/得る-得る	strict-deck; bunpro:得る-得る; 得る・得る; Is able to, Can, Possible
思うように	n2	04-n2	bunpro:思うように			sk:auto/n2	djg:bunpro/思うように	strict-deck; bunpro:思うように; 思うように; As one hopes, As desired, As one thought
恐れがある	n2	04-n2	bunpro:恐れがある			sk:auto/n2	djg:bunpro/恐れがある	strict-deck; bunpro:恐れがある; 恐れがある; There is a risk or fear that, Be in danger of, Possibility of
手前	n2	04-n2	bunpro:手前			sk:auto/n2	djg:bunpro/手前	strict-deck; bunpro:手前; 手前; Before, In front of, From one's standpoint or side
抜きで	n2	04-n2	bunpro:抜きで			sk:auto/n2	djg:bunpro/抜きで	strict-deck; bunpro:抜きで; 抜きで; Without, Unless
抜く	n2	04-n2	bunpro:抜く			sk:auto/n2	djg:bunpro/抜く	strict-deck; bunpro:抜く; 抜く; All~, Completely, See through, Overcome, To the bitter end
未だに	n2	04-n2	bunpro:未だに			sk:auto/n2	djg:bunpro/未だに	strict-deck; bunpro:未だに; 未だに; Still, Not yet, Even now
次第だ-次第で	n2	04-n2	bunpro:次第だ-次第で			sk:auto/n2	djg:bunpro/次第だ-次第で	strict-deck; bunpro:次第だ-次第で; 次第だ・次第で; Depending on, So
次第に	n2	04-n2	bunpro:次第に			sk:auto/n2	djg:bunpro/次第に	strict-deck; bunpro:次第に; 次第に; Gradually
気	n2	04-n2	bunpro:気			sk:auto/n2	djg:bunpro/気	strict-deck; bunpro:気; 気; Feel like ~, Spirit
活かす	n2	04-n2	bunpro:活かす			sk:auto/n2	djg:bunpro/活かす	strict-deck; bunpro:活かす; 活かす; To make use of (something), To take full advantage of, To capitalize on, To leverage (skills), Bring out (the quality of)
甲斐がある	n2	04-n2	bunpro:甲斐がある			sk:auto/n2	djg:bunpro/甲斐がある	strict-deck; bunpro:甲斐がある; 甲斐がある; To be (not) worth, To (not) pay off
確かに	n2	04-n2	bunpro:確かに			sk:auto/n2	djg:bunpro/確かに	strict-deck; bunpro:確かに; 確かに; Surely, Certainly
精々	n2	04-n2	bunpro:精々			sk:auto/n2	djg:bunpro/精々	strict-deck; bunpro:精々; 精々; (At) most , (At) best, No more than, Barely
結果・の結果	n2	04-n2	bunpro:結果・の結果			sk:auto/n2	djg:bunpro/結果・の結果	strict-deck; bunpro:結果・の結果; 結果・の結果; As a result of
要するに	n2	04-n2	bunpro:要するに			sk:auto/n2	djg:bunpro/要するに	strict-deck; bunpro:要するに; 要するに; To sum up, In summary, In short
逆に	n2	04-n2	bunpro:逆に			sk:auto/n2	djg:bunpro/逆に	strict-deck; bunpro:逆に; 逆に; On the contrary
途中に・途中で	n2	04-n2	bunpro:途中に・途中で			sk:auto/n2	djg:bunpro/途中に・途中で	strict-deck; bunpro:途中に・途中で; 途中に・途中で; On the way, Partway, In the middle of
限り	n2	04-n2	bunpro:限り			sk:auto/n2	djg:bunpro/限り	strict-deck; bunpro:限り; 限り; As long as, While… is the case, Limited to
陸に-ない	n2	04-n2	bunpro:陸に-ない			sk:auto/n2	djg:bunpro/陸に-ない	strict-deck; bunpro:陸に-ない; 陸に～ない; Not well or properly, Not much or enough, Barely, Hardly
際に	n2	04-n2	bunpro:際に			sk:auto/n2	djg:bunpro/際に	strict-deck; bunpro:際に; 際に; When, At the time of, In case of, On the occasion of
～ところに・～ところへ	n2	04-n2	bunpro:～ところに・～ところへ			sk:auto/n2	djg:bunpro/～ところに・～ところへ	strict-deck; bunpro:～ところに・～ところへ; ～ところに・～ところへ; At the time, When, While, Timing
～ばと思います	n2	04-n2	bunpro:～ばと思います			sk:auto/n2	djg:bunpro/～ばと思います	strict-deck; bunpro:～ばと思います; ～ばと思います; I would appreciate it if, If you could, I would like to think that
-なり-なり	n1	05-n1	bunpro:-なり-なり			sk:auto/n1	djg:bunpro/-なり-なり	strict-deck; bunpro:-なり-なり; ～なり～なり; Or, Either or
